{
  "schema_version": "1.0",
  "producer_commit": "fixture-commit",
  "generated_at_utc": "2026-08-11T12:00:00Z",
  "data_cutoff": {"IN": "2026-08-11", "US": "2026-08-10"},
  "markets": ["IN", "US"],
  "timeframes": ["daily", "weekly"],
  "pages": {
    "weekly": {
      "default_window": 8,
      "payload": {
        "screener": "fixture-weekly",
        "source_url": "https://example.test/weekly",
        "scanlink": "fixture",
        "timeframe": "weekly",
        "weeks": [{"week": "2026-08-10", "tickers": [{"symbol": "TEST", "sector": "Test", "marketcap": "Small"}]}],
        "cross": {"label": "D", "name": "daily", "url": "https://example.test/daily", "weeks": {"2026-08-11": ["TEST"]}},
        "rotation": {"window": 13, "levels": ["sector", "industry", "basic"], "levelNames": {"sector": "Sector", "industry": "Industry", "basic": "Basic Industry"}, "status": {"sector": {"Test": 1}, "industry": {"Test": 1}, "basic": {"Test": 1}}, "of": {"TEST": ["Test", "Test", "Test"]}}
      }
    },
    "daily": {
      "payload": {
        "screener": "fixture-daily",
        "source_url": "https://example.test/daily",
        "scanlink": "fixture",
        "timeframe": "daily",
        "weeks": [{"week": "2026-08-11", "tickers": [{"symbol": "TEST", "sector": "Test", "marketcap": "Small"}]}],
        "signals": [],
        "cross": {"label": "W", "name": "weekly", "url": "https://example.test/weekly", "weeks": {"2026-08-10": ["TEST"]}},
        "rotation": {"window": 13, "levels": ["sector", "industry", "basic"], "levelNames": {"sector": "Sector", "industry": "Industry", "basic": "Basic Industry"}, "status": {"sector": {"Test": 1}, "industry": {"Test": 1}, "basic": {"Test": 1}}, "of": {"TEST": ["Test", "Test", "Test"]}}
      }
    },
    "market": {
      "payload": {"screeners": [], "counts": {}, "cap_days": 274, "mcclellan": []}
    },
    "sectors": {
      "payload": {"weeks": [], "counts": {"sector": {}, "industry": {}, "basic": {}}, "totals": [], "parents": {}, "cap_weeks": 40}
    },
    "recommendations": {
      "payload": {"summary": {"presented": 0, "near_misses": 0, "tracked": 0, "opportunity_misses": 0}, "rows": []}
    }
  },
  "source_freshness": {
    "weekly": {"as_of": "2026-08-10"},
    "daily": {"as_of": "2026-08-11"},
    "market": {"as_of": "2026-08-11"},
    "sectors": {"as_of": "2026-08-10"}
  },
  "event_gate_status": {"earnings": "fixture"},
  "artifacts": []
}
